user_id,user,as a,I would like to,such that I can,sum
https://orcid.org/0000-0001-2345-6789,Franz Schaefer,Data steward of a patient registry,be guided towards good FAIR implementation choices for my data,make my data efficiently useable in combination with other FAIR resources in automated scenarios,As a Data steward of a patient registry I would like to be guided towards good FAIR implementation choices for my data such that I can make my data efficiently useable in combination with other FAIR resources in automated scenarios.
https://orcid.org/0000-0001-2345-9876,Bruna DosSantos,FAIR data steward,be guided towards good FAIR implementation choices for my data,make my data efficiently useable in combination with other FAIR resources in automated scenarios,As a FAIR data steward I would like to be guided towards good FAIR implementation choices for my data such that I can make my data efficiently useable in combination with other FAIR resources in automated scenarios.
https://orcid.org/0000-0001-2345-6789,Franz Schaefer,Data steward of a patient registry,generate a FAIRification plan,provide information to other stakeholders who build the architecture of the system.,As a Data steward of a patient registry I would like to generate a FAIRification plan such that I can provide information to other stakeholders who build the architecture of the system.
https://orcid.org/0000-0001-2345-6789,Franz Schaefer,Data steward of a patient registry,generate a FAIRification plan,provide information to PIs to make decisions on the system.,As a Data steward of a patient registry I would like to generate a FAIRification plan such that I can provide information to PIs to make decisions on the system.
https://orcid.org/0000-0001-2345-2345,Pablo Alarcon,Explorer of the virtual platform,get information,learn how to use the tool efficiently.,As a Explorer of the virtual platform I would like to get information such that I can learn how to use the tool efficiently.